{
  "calls": [
    {
      "anchor_after": {
        "epoch": 0,
        "fortress_id": "660123",
        "game_tick": 1,
        "sequence": 0,
        "state_hash": "53b3da0ad373ca0ca0ee557cf9c017905cebdf59a54f8369d4c2e47dcf3767e5"
      },
      "arguments": {
        "durable": null,
        "fortress_selector": "660123",
        "max_actions": null,
        "max_bytes": null,
        "max_entities": null,
        "max_game_ticks": 10000,
        "max_output_tokens": 8192,
        "max_wall_millis": null,
        "paused": false,
        "requested_capabilities": [
          [
            "observe",
            "read_only"
          ],
          [
            "query",
            "read_only"
          ],
          [
            "plan",
            "reversible"
          ],
          [
            "control_clock",
            "reversible"
          ],
          [
            "checkpoint",
            "guarded"
          ],
          [
            "restore",
            "guarded"
          ],
          [
            "designate",
            "guarded"
          ]
        ],
        "scenario": "starter_fortress",
        "shared": null
      },
      "error_code": null,
      "ok": true,
      "seq": 0,
      "tool": "fortress.open_session"
    },
    {
      "anchor_after": {
        "epoch": 0,
        "fortress_id": "660123",
        "game_tick": 1,
        "sequence": 0,
        "state_hash": "53b3da0ad373ca0ca0ee557cf9c017905cebdf59a54f8369d4c2e47dcf3767e5"
      },
      "arguments": {
        "actions": "[{\"action\":{\"kind\":\"designate_dig\",\"min\":[1,3,10],\"max\":[4,4,10],\"mode\":\"mine\"}}]",
        "blueprint": null,
        "paused_target": null,
        "summary": null
      },
      "error_code": null,
      "ok": true,
      "seq": 1,
      "tool": "fortress.plan"
    },
    {
      "anchor_after": {
        "epoch": 0,
        "fortress_id": "660123",
        "game_tick": 1,
        "sequence": 1,
        "state_hash": "70ca5902bff9819de580553b666fbab8327a68a987f1f9c860269fe78352c1f5"
      },
      "arguments": {
        "plan_digest": "b176c64667cdabdf7db47b1d51763c8ae751177e6a8fcbd902df360a5ff75450"
      },
      "error_code": null,
      "ok": true,
      "seq": 2,
      "tool": "fortress.commit"
    },
    {
      "anchor_after": {
        "epoch": 0,
        "fortress_id": "660123",
        "game_tick": 1,
        "sequence": 1,
        "state_hash": "70ca5902bff9819de580553b666fbab8327a68a987f1f9c860269fe78352c1f5"
      },
      "arguments": {
        "label": null
      },
      "error_code": null,
      "ok": true,
      "seq": 3,
      "tool": "fortress.checkpoint"
    },
    {
      "anchor_after": {
        "epoch": 0,
        "fortress_id": "660123",
        "game_tick": 101,
        "sequence": 10,
        "state_hash": "ddb9638f16d8393856a3f99bcd425078d80930e6f167a24ca1a131ecd1b2fbaa"
      },
      "arguments": {
        "max_game_ticks": 100
      },
      "error_code": null,
      "ok": true,
      "seq": 4,
      "tool": "fortress.wait"
    },
    {
      "anchor_after": {
        "epoch": 0,
        "fortress_id": "660123",
        "game_tick": 101,
        "sequence": 10,
        "state_hash": "ddb9638f16d8393856a3f99bcd425078d80930e6f167a24ca1a131ecd1b2fbaa"
      },
      "arguments": {
        "plan_digest": "0000000000000000000000000000000000000000000000000000000000000000"
      },
      "error_code": "invalid_plan",
      "ok": false,
      "seq": 5,
      "tool": "fortress.commit"
    },
    {
      "anchor_after": {
        "epoch": 1,
        "fortress_id": "660123",
        "game_tick": 1,
        "sequence": 0,
        "state_hash": "bf442b2986780a234a48c051f73a2d2996ca44b4c1cec24c5f3e1f55c7bee7f6"
      },
      "arguments": {
        "checkpoint_id": "7a0fb2a5c353135cf8fcbfd2132a0628"
      },
      "error_code": null,
      "ok": true,
      "seq": 6,
      "tool": "fortress.restore"
    },
    {
      "anchor_after": {
        "epoch": 1,
        "fortress_id": "660123",
        "game_tick": 1,
        "sequence": 0,
        "state_hash": "bf442b2986780a234a48c051f73a2d2996ca44b4c1cec24c5f3e1f55c7bee7f6"
      },
      "arguments": {},
      "error_code": null,
      "ok": true,
      "seq": 7,
      "tool": "fortress.observe"
    }
  ],
  "calls_digest": "d4860ec892160a4f4a40fbe096c3e3bd7212f49cd9814def87d445e0119fd6ff",
  "not_replayable_reason": null,
  "note": "replay with `dwarf-fortress-mcp replay <bundle.json>`; every call is re-executed in a fresh laboratory session and compared by outcome and resulting canonical anchor",
  "replayable": true,
  "schema": "dfmcp.replay.bundle/1",
  "server_version": "0.0.1",
  "truncated": false
}
